Remove workpieces from molds.,9,1
"Remove worn, damaged or outdated materials from work areas.",9,1
Reconcile records of sales or other financial transactions.,9,1
Verify employee information.,9,1
Measure physical characteristics of forestry or agricultural products.,9,1
"Mark products, workpieces, or equipment with identifying information.",9,1
Mark materials or objects for identification.,9,1
Mark agricultural or forestry products for identification.,9,1
Maneuver workpieces in equipment during production.,9,1
Manage environmental sustainability projects.,9,1
Relay information about incidents or emergencies to personnel using phones or two-way radios.,9,1
Relay information between personnel.,9,1
Manage food service operations or parts of operations.,9,1
Manage healthcare operations.,9,1
Write computer programming code.,9,1
Manage inventories of products or organizational resources.,9,1
Record research or operational data.,9,1
"Manage operations, research, or logistics projects.",9,1
Manage organizational or project budgets.,9,1
Write advertising or promotional material.,9,1
Remove parts or components from equipment.,9,1
Manage scientific or technical project resources.,9,1
Weigh materials to ensure compliance with specifications.,9,1
Record information about suspects or criminals.,9,1
Verify customer credit information.,9,1
Measure product or material dimensions.,9,1
Recommend organizational process or policy changes.,9,1
Update computer database information.,9,1
Unload materials or equipment.,9,1
Read technical information needed to perform maintenance or repairs.,9,1
Monitor availability of equipment or supplies.,9,1
Monitor broadcasting operations to ensure proper functioning.,9,1
Read documents to gather technical information.,9,1
Monitor construction operations.,9,1
Trim excess material from workpieces.,9,1
Trim excess material from installations.,9,1
Treat patients using physical therapy techniques.,9,1
Repair non-engine automotive or vehicle components.,9,1
Monitor engine operation or functioning.,9,1
"Purchase materials, equipment, or other resources.",9,1
Provide transportation information to passengers or customers.,9,1
Monitor environmental conditions to detect hazards.,9,1
Monitor environmental impacts of production or development activities.,9,1
Read work orders or descriptions of problems to determine repairs or modifications needed.,9,1
Reassemble equipment after repair.,9,1
Recommend legal actions.,9,1
Rebuild parts or components.,9,1
Verify accuracy of financial information.,9,1
Measure the physical or physiological attributes of patients.,9,1
Verify accuracy of data.,9,1
Usher patrons to seats or exits.,9,1
Use weapons or physical force to maintain security.,9,1
Recommend improvements to increase safety or reduce risks.,9,1
"Melt metal, plastic, or other materials to prepare for production.",9,1
Update website content.,9,1
Recommend changes to improve computer or information systems.,9,1
Mix sound inputs.,9,1
Update technical knowledge.,9,1
Recommend changes or corrective procedures.,9,1
Receive shipments.,9,1
Update professional knowledge.,9,1
Update knowledge about emerging industry or technology trends.,9,1
Train others in computer interface or software use.,9,1
Test patient hearing.,9,1
Report vehicle or equipment malfunctions.,9,1
"Order materials, supplies, or equipment.",9,1
Rewire electrical or electronic systems.,9,1
Order medical supplies or equipment.,9,1
Refer individuals to educational or work programs.,9,1
Organize recreational activities or events.,9,1
Organize special events.,9,1
Prepare medical supplies or equipment for use.,9,1
Package materials for transport.,9,1
Run wiring to connect equipment.,9,1
Schedule activities or facility use.,9,1
Sort materials or objects for processing or transport.,9,1
Package products for storage or shipment.,9,1
Prepare materials or solutions for animal or plant use.,9,1
Sort forestry or agricultural materials.,9,1
Solder parts or connections between parts.,9,1
Participate in physical training to maintain fitness.,9,1
Participate in staffing decisions.,9,1
Schedule equipment maintenance.,9,1
"Pay charges, fees, or taxes.",9,1
Perform administrative or clerical tasks.,9,1
Review professional literature to maintain professional knowledge.,9,1
Sterilize food cooking or processing equipment.,9,1
Study scripts to determine project requirements.,9,1
Review plans or proposals for environmental conservation.,9,1
Operate painting or coating equipment.,9,1
Prepare outgoing mail.,9,1
Study blueprints or other instructions to determine equipment setup requirements.,9,1
Prepare operational reports.,9,1
Operate pumping systems or equipment.,9,1
Store records or related materials.,9,1
Review blueprints or specifications to determine work requirements.,9,1
Operate recycling equipment.,9,1
Review customer information.,9,1
Operate sewing equipment.,9,1
Stock serving stations or dining areas with food or supplies.,9,1
Operate ships or other watercraft.,9,1
Operate still or video cameras or related equipment.,9,1
Review customer insurance information.,9,1
Review details of technical drawings or specifications.,9,1
Prepare operational budgets.,9,1
Operate welding equipment.,9,1
Stock products or parts.,9,1
Stock medical or patient care supplies.,9,1
Smooth surfaces of objects or equipment.,9,1
Perform housekeeping duties.,9,1
Smooth metal surfaces or edges.,9,1
"Perform manual agricultural, aquacultural, or horticultural tasks.",9,1
"Polish materials, workpieces, or finished products.",9,1
Prepare excavation or extraction sites for commissioning or decommissioning.,9,1
Service vehicles to maintain functionality.,9,1
Position material handling equipment.,9,1
Prepare drawings or diagrams of products or services.,9,1
Select medical equipment for addressing patient needs.,9,1
Prepare documentation for permits or licenses.,9,1
Serve on institutional or departmental committees.,9,1
Serve food or beverages.,9,1
"Prepare documentation for contracts, transactions, or regulatory compliance.",9,1
Position structural components.,9,1
"Send information, materials or documentation.",9,1
Prepare detailed work plans.,9,1
Prepare administrative documents.,9,1
Prepare analytical reports.,9,1
"Prepare biological feedstock for physical, chemical, or biological processing.",9,1
Select production equipment according to product specifications.,9,1
Prepare contracts or other transaction documents.,9,1
Prepare compounds or solutions for products or testing.,9,1
"Plant crops, trees, or other plants.",9,1
Select educational materials or equipment.,9,1
Select construction materials.,9,1
Plan educational activities.,9,1
Perform marketing activities.,9,1
Prepare legal or investigatory documentation.,9,1
Prepare legal documents.,9,1
Signal others to coordinate work activities.,9,1
Prepare informational or reference materials.,9,1
Prepare information or documentation related to legal or regulatory matters.,9,1
Signal equipment operators to indicate proper equipment positioning.,9,1
Schedule operational activities.,9,1
Plan employee work schedules.,9,1
Select construction equipment.,9,1
Schedule patient procedures or appointments.,9,1
Schedule product or material transportation.,9,1
Prepare healthcare training materials.,9,1
Set up still or video cameras or related equipment.,9,1
Plan menu options.,9,1
Set up merchandise displays.,9,1
"Set up material handling gear or equipment, such as rigging, packaging, or temporary structures.",9,1
Plan programs to address community mental wellness needs.,9,1
Review art or design materials.,9,1
Submit financial applications.,9,1
"Train employees on environmental awareness, conservation, or safety topics.",9,1
Present information to the public.,9,1
Move patients to or from treatment areas.,9,1
"Test materials, solutions, or samples.",9,1
Test fluids to identify contamination or other problems.,9,1
Test facilities for environmental hazards.,9,1
"Negotiate contracts for environmental remediation, green energy, or renewable resources.",9,1
Negotiate contracts with clients or service providers.,9,1
Negotiate financial arrangements.,9,1
Research industrial processes or operations.,9,1
Negotiate for services.,9,1
Present food or beverage information or menus to customers.,9,1
Present business-related information to audiences.,9,1
Negotiate project specifications.,9,1
Prescribe treatments or therapies.,9,1
Notify others of equipment problems.,9,1
Prescribe medications.,9,1
Research methods to improve food products.,9,1
Prescribe assistive medical devices or related treatments.,9,1
Research new technologies.,9,1
Observe individuals' activities to gather information or compile evidence.,9,1
Move large objects using heavy equipment.,9,1
Present medical research reports.,9,1
Supervise activities of other legal personnel.,9,1
Prepare breads or doughs.,9,1
Monitor processes for compliance with standards.,9,1
Process x-rays or other medical images.,9,1
Train construction or extraction personnel.,9,1
Monitor sales activities.,9,1
Track goods or materials.,9,1
Thread wire or cable through ducts or conduits.,9,1
Monitor surroundings to detect potential hazards.,9,1
Monitor the handling of hazardous materials or medical wastes.,9,1
Test software performance.,9,1
Monitor the security of digital information.,9,1
Test products for functionality or quality.,9,1
Monitor video displays of medical equipment to ensure proper functioning.,9,1
Process healthcare paperwork.,9,1
Process forensic or legal evidence in accordance with procedures.,9,1
Test patient vision.,9,1
Test patient nervous system functioning.,9,1
Present work to clients for approval.,9,1
Research impacts of environmental conservation initiatives.,9,1
Present research results to others.,9,1
Research relevant legal materials to aid decision making.,9,1
Prepare tests.,9,1
Test air quality at work sites.,9,1
Obtain personal or financial information about customers or applicants.,9,1
Operate firefighting equipment.,9,1
Operate forklifts or other loaders.,9,1
Prepare reports summarizing patient diagnostic or care activities.,9,1
Prepare reports related to compliance matters.,9,1
Resolve employee or contractor problems.,9,1
Prepare regulatory or compliance documentation.,9,1
Resolve operational performance problems.,9,1
Respond to customer problems or complaints.,9,1
Supervise scientific or technical personnel.,9,1
Operate industrial equipment.,9,1
Supervise school or student activities.,9,1
Supervise patient care personnel.,9,1
Retrieve information from electronic sources.,9,1
Operate metal or plastic forming equipment.,9,1
Operate mixing equipment.,9,1
Supervise maintenance workers.,9,1
Operate natural gas generation equipment.,9,1
Supervise laboratory work.,9,1
Supervise engineering or other technical personnel.,9,1
Take customer orders.,9,1
Prepare research reports.,9,1
Teach classes in area of specialization.,9,1
Research topics in area of expertise.,9,1
Teach safety standards or environmental compliance methods.,9,1
Teach others to use technology or equipment.,9,1
Teach others to use computer equipment or hardware.,9,1
Operate biomass or biofuel production equipment.,9,1
Operate cash registers.,9,1
Operate communications equipment or systems.,9,1
Teach life skills.,9,1
Operate computers or computerized equipment.,9,1
Resolve computer network problems.,9,1
Operate energy distribution equipment.,9,1
Prepare staff schedules or work assignments.,9,1
Prepare scientific or technical reports or presentations.,9,1
"Operate cooking, baking, or other food preparation equipment.",9,1
Operate cutting equipment.,9,1
Teach health management classes.,9,1
Operate diagnostic or therapeutic medical instruments or equipment.,9,1
Prepare sales or other contracts.,9,1
Teach exercise or fitness techniques.,9,1
Refer patients to other healthcare practitioners or health resources.,9,1
Install building fixtures.,9,1
Manage content of broadcasts or presentations.,9,1
Determine forestry techniques or methods.,9,1
Develop procedures for data entry or processing.,9,1
Develop procedures for data management.,9,1
Develop promotional materials.,9,1
Arrange services or reservations for patrons.,9,1
Develop software or applications for scientific or technical use.,9,1
Develop specifications for new products or processes.,9,1
Develop strategies or programs for students with special needs.,9,1
Arrange physical or mental health services for clients.,9,1
Develop training materials.,9,1
Develop treatment plans for patients or clients.,9,1
Develop working relationships with others to facilitate program activities.,9,1
Devise research or testing protocols.,9,1
Arrange food for serving.,9,1
Diagnose equipment malfunctions.,9,1
Direct administrative or support services.,9,1
Direct construction activities.,9,1
Direct construction or extraction personnel.,9,1
Arrange childcare or educational settings to ensure physical safety of children.,9,1
Direct department activities.,9,1
Direct facility maintenance or repair activities.,9,1
Direct fire fighting or prevention activities.,9,1
Appraise property values.,9,1
Apply sealants or other protective coatings.,9,1
Direct natural resources management or conservation programs.,9,1
Apply protective or decorative finishes to workpieces or products.,9,1
"Direct sales, marketing, or customer service activities.",9,1
Direct scientific activities.,9,1
Arrange tables or dining areas.,9,1
"Assemble electrical components, subsystems, or systems.",9,1
Develop performance metrics or standards related to information technology.,9,1
Develop environmental sustainability plans or projects.,9,1
Determine operational compliance with regulations or standards.,9,1
Determine operational methods.,9,1
Determine the value of goods or services.,9,1
"Develop artistic or design concepts for decoration, exhibition, or commercial purposes.",9,1
Develop business or financial information systems.,9,1
Develop business or market strategies.,9,1
Develop computer or information security policies or procedures.,9,1
Develop computer or online applications.,9,1
Develop educational policies.,9,1
Assess compliance with environmental laws.,9,1
Develop emergency procedures.,9,1
Develop environmental remediation or protection plans.,9,1
Develop exercise or conditioning programs.,9,1
Develop organizational goals or objectives.,9,1
Assemble temporary equipment or structures.,9,1
Develop financial or business plans.,9,1
Assemble products or production equipment.,9,1
Develop guidelines for system implementation.,9,1
Develop health assessment methods or programs.,9,1
Assemble precision electronics or optical equipment.,9,1
Assemble mechanical components or machine parts.,9,1
Develop marketing plans or strategies for environmental initiatives.,9,1
Assemble equipment or components.,9,1
Develop methods of social or economic research.,9,1
Develop new or advanced products or production methods.,9,1
"Develop operating strategies, plans, or procedures for green or sustainable operations.",9,1
Direct security operations.,9,1
Direct surveying activities.,9,1
Disassemble equipment for maintenance or repair.,9,1
Estimate time or monetary resources needed to complete projects.,9,1
Establish operational policies.,9,1
"Apply bandages, dressings, or splints.",9,1
Establish organizational guidelines or policies.,9,1
Analyze test or performance data to assess equipment operation.,9,1
Estimate construction project labor requirements.,9,1
Estimate costs for labor or materials.,9,1
Estimate costs for projects or productions.,9,1
Estimate costs of goods or services.,9,1
Estimate materials requirements for projects.,9,1
Estimate operational costs.,9,1
Analyze shipping information to make routing decisions.,9,1
Estimate technical or resource requirements for development or production projects.,9,1
Estimate time requirements for development or production projects.,9,1
Apply chemical solutions to plants to protect against disease or insects or to enhance growth.,9,1
Evaluate characteristics of equipment or systems.,9,1
Evaluate characteristics of individuals to determine needs or eligibility.,9,1
Evaluate construction projects to determine compliance with external standards or regulations.,9,1
Evaluate current or prospective maintenance employees.,9,1
Evaluate designs or specifications to ensure quality.,9,1
Evaluate effectiveness of educational programs.,9,1
Evaluate effectiveness of personnel policies or practices.,9,1
Analyze project data to determine specifications or requirements.,9,1
Evaluate employee performance.,9,1
Evaluate green operations or programs for compliance with standards or regulations.,9,1
"Analyze physical, survey, or geographic data.",9,1
Evaluate log quality.,9,1
Establish nursing policies or standards.,9,1
Establish business management methods.,9,1
Disburse funds from clients accounts to creditors.,9,1
Document legal or regulatory information.,9,1
Discuss design or technical features of products or services with technical personnel.,9,1
Discuss designs or plans with clients.,9,1
Discuss goods or services information with customers or patrons.,9,1
Apply protective coverings to objects or surfaces near work areas.,9,1
Apply paint to surfaces.,9,1
Dispose of biomedical waste in accordance with standards.,9,1
"Clean equipment, parts, or tools to repair or maintain them in good working order.",9,1
Distribute materials to employees or customers.,9,1
Distribute promotional literature or samples to customers.,9,1
Apply mortar.,9,1
Document design or operational test results.,9,1
Document information related to legal proceedings.,9,1
Document organizational or operational procedures.,9,1
Entertain public with comedic or dramatic performances.,9,1
Apply mathematical principles or statistical approaches to solve problems in scientific or applied fields.,9,1
Draw detailed or technical illustrations.,9,1
Drill holes in construction materials.,9,1
Apply lubricants or coolants to workpieces.,9,1
Drive passenger vehicles.,9,1
Educate clients on financial planning topics.,9,1
Educate the public about fire safety or prevention.,9,1
"Apply finishes to artwork, crafts, or displays.",9,1
Apply decorative masonry finishes.,9,1
Enforce rules or policies governing student behavior.,9,1
"Enter commands, instructions, or specifications into equipment.",9,1
Enter patient or treatment data into computers.,9,1
Determine metal or plastic production methods.,9,1
Assess skin or hair conditions.,9,1
Evaluate performance of educational staff.,9,1
Determine food production methods.,9,1
Communicate with other construction or extraction personnel to discuss project details.,9,1
Communicate with other workers to coordinate activities.,9,1
Communicate with others to coordinate material handling or movement.,9,1
Calculate costs of goods or services.,9,1
Communicate with others to coordinate vehicle movement.,9,1
Compare physical characteristics of materials or products to specifications or standards.,9,1
Compile environmental or climatological data.,9,1
Compile specialized bibliographies or lists of materials.,9,1
Compile technical information or documentation.,9,1
Conduct amusement or gaming activities.,9,1
Conduct climatological research.,9,1
Conduct diagnostic tests to determine patient health.,9,1
Conduct employee training programs.,9,1
Conduct environmental audits.,9,1
"Break up rock, asphalt, or concrete.",9,1
Bolt objects into place.,9,1
Balance receipts.,9,1
Authorize financial actions.,9,1
Conduct research of processes in natural or industrial ecosystems.,9,1
"Conduct research to inform art, designs, or other work.",9,1
Conduct scientific research of organizational behavior or processes.,9,1
Conduct validation tests of equipment or processes.,9,1
Audition for roles.,9,1
Attend training to learn new skills or update knowledge.,9,1
Confer with clients to determine needs.,9,1
Confer with coworkers to resolve equipment problems.,9,1
Attend training sessions or professional meetings to develop or maintain professional knowledge.,9,1
Communicate with management or other staff to resolve problems.,9,1
Communicate with government agencies.,9,1
"Communicate with clients about products, procedures, and policies.",9,1
Cast molds of patient anatomies to create medical or dental devices.,9,1
Clean facilities or equipment.,9,1
Clean facilities or work areas.,9,1
Clean food service areas.,9,1
Clean machinery or equipment.,9,1
Clean materials to prepare them for production.,9,1
Clean medical equipment or facilities.,9,1
Clean objects.,9,1
Check data for recording errors.,9,1
Clean tableware.,9,1
Clean work sites.,9,1
Climb ladders or vehicles to perform duties.,9,1
Code data or other information.,9,1
Care for animals.,9,1
Calculate data to inform organizational operations.,9,1
Collaborate with other agencies and institutions to coordinate educational matters.,9,1
Collaborate with other professionals to assess client needs or plan treatments.,9,1
Calibrate scientific or technical equipment.,9,1
Collaborate with others to develop or implement marketing strategies.,9,1
Calculate tax information.,9,1
Calculate shipping costs.,9,1
Collect information about community health needs.,9,1
"Collect information from people through observation, interviews, or surveys.",9,1
Collect samples for analysis or testing.,9,1
Calculate requirements for equipment installation or repair projects.,9,1
Communicate green energy production information.,9,1
Communicate health and wellness information to the public.,9,1
Confer with customers or designers to determine order specifications.,9,1
Confer with organizational members to accomplish work activities.,9,1
Confer with others about financial matters.,9,1
Design environmental control systems.,9,1
Customize energy products or services to meet customer needs.,9,1
Cut cooked or raw foods.,9,1
Assist others during emergencies.,9,1
"Cut tile, stone, or other masonry materials.",9,1
Decontaminate equipment or sites to remove hazardous or toxic substances.,9,1
Demonstrate products to consumers.,9,1
Design civil structures or systems.,9,1
Design electrical equipment or systems.,9,1
Assist customers with seating arrangements.,9,1
Assist clients in handling details of daily life.,9,1
Design electromechanical equipment or systems.,9,1
Design electronic or computer equipment or instrumentation.,9,1
Design integrated computer systems.,9,1
Create models of engineering designs or methods.,9,1
Design layouts for print publications.,9,1
Design medical devices or appliances.,9,1
"Design micro- or nano-scale materials, devices, or systems.",9,1
Design psychological or educational treatment procedures or programs.,9,1
Design structures or facilities.,9,1
Design systems to reduce harmful emissions.,9,1
Design templates or patterns.,9,1
Detain suspects or witnesses.,9,1
Determine appropriate methods for data analysis.,9,1
Determine causes of operational problems or failures.,9,1
"Assess the cost effectiveness of products, projects, or services.",9,1
Determine design criteria or specifications.,9,1
Assist skilled construction or extraction personnel.,9,1
"Create images of data, locations, or products.",9,1
Attend events to develop professional knowledge.,9,1
Cook foods.,9,1
Confer with personnel to coordinate business operations.,9,1
Attend educational events to update medical knowledge.,9,1
Connect hoses to equipment or machinery.,9,1
Connect supply lines to production equipment or tools.,9,1
Construct customized assistive medical or dental devices.,9,1
"Construct distinctive physical objects for artistic, functional, or commercial purposes.",9,1
Construct exhibits or parts of exhibits.,9,1
"Construct patterns, templates, or other work aids.",9,1
Attend conferences or workshops to maintain professional knowledge.,9,1
Control power supply connections.,9,1
Control prescription refills or authorizations.,9,1
Control pumps or pumping equipment.,9,1
Coordinate activities of food service staff.,9,1
Attach decorative or functional accessories to products.,9,1
"Coordinate activities with suppliers, contractors, clients, or other departments.",9,1
Coordinate flight control or management activities.,9,1
"Attach identification information to products, items or containers.",9,1
Coordinate regulatory documentation activities.,9,1
Coordinate safety or regulatory compliance activities.,9,1
Coordinate sales campaigns.,9,1
Coordinate special events or programs.,9,1
Create computer-generated graphics or animation.,9,1
Create construction or installation diagrams.,9,1
Create databases to store electronic data.,9,1
Create diagrams or blueprints for workpieces or products.,9,1
Create electronic data backup to prevent loss of information.,9,1
Evaluate logistics methods to reduce environmental impact.,9,1
Clean fabrics or apparel.,9,1
Inspect motor vehicles.,9,1
Immerse objects or workpieces in cleaning or coating solutions.,9,1
Hire personnel.,9,1
Hold patients to ensure proper positioning or safety.,9,1
Inspect products or operations to ensure that standards are met.,9,1
Inspect production equipment.,9,1
Inspect plumbing systems or fixtures.,9,1
Evaluate personnel practices to ensure adherence to regulations.,9,1
Maintain clean work areas.,9,1
"Inspect metal, plastic, or composite products.",9,1
Maintain call records.,9,1
Identify investment opportunities or strategies.,9,1
Identify opportunities to improve operational efficiency.,9,1
Advise others on matters of public policy.,9,1
Identify potential customers.,9,1
