Administer drug screening tests.,1,9
Slaughter animals.,1,9
Measure radiation levels.,1,9
Inspect timing devices.,1,9
Handle caskets.,1,9
Analyze laboratory findings.,1,9
Participate in athletic events.,1,9
Position animal trapping or capture equipment.,1,9
Provide care for animals.,1,9
Teach online courses.,1,9
Cut glass.,1,9
Sew materials.,1,9
Check physical condition of people or animals.,1,9
Direct operations of correctional facilities.,2,8
Direct funeral or mortuary activities.,2,8
Choreograph dances.,2,8
Direct criminal investigations.,2,8
Monitor biofuel production operations.,2,8
"Cultivate micro-organisms for study, testing, or medical preparations.",2,8
Assemble tires.,2,8
Guard facilities.,2,8
Inspect installed components or assemblies.,2,8
Make decisions in legal cases.,2,8
Perform dances.,2,8
Operate natural gas distribution equipment.,2,8
Operate gaming equipment.,2,8
Teach physical education.,3,7
Prepare activity or work schedules.,3,7
Conduct anthropological or archaeological research.,3,7
Determine construction project layouts.,3,7
Compute gaming wins and losses.,3,7
Distribute supplies to workers.,3,7
Time vehicle speed or traffic-control equipment operation.,3,7
Issue warnings or citations.,3,7
Perform forest firefighting activities.,3,7
"Escort prisoners to courtrooms, prisons, or other facilities.",3,7
Develop program goals or plans.,3,7
Operate textile cutting or production equipment.,3,7
Research livestock management methods.,3,7
Operate audio-visual equipment.,3,7
Analyze forensic evidence to solve crimes.,3,7
Guide patrons on tours.,3,7
Locate suspicious objects or vehicles.,4,6
Identify actions needed to bring properties or facilities into compliance with regulations.,4,6
Control equipment that regulates vehicle traffic.,4,6
Modify treatment plans to accommodate client needs.,4,6
Inspect facilities for cleanliness.,4,6
Reshape small metal components for precision assembly.,4,6
Resolve interpersonal conflicts.,4,6
Conduct gaming transactions.,4,6
Resolve personnel problems.,4,6
Authorize payments to settle legal disputes.,4,6
Monitor traffic signals.,4,6
Prepare written decisions for legal proceedings.,4,6
Operate locomotives or other rail vehicles.,4,6
Support the professional development of others.,4,6
"Examine mouth, teeth, gums, or related facial structures.",4,6
Develop biological research methods.,4,6
Develop healthcare quality and safety procedures.,4,6
Diagnose dental conditions.,4,6
Assemble electrical or electronic equipment.,4,6
Make patient-assistive devices or device models.,4,6
Supervise technical medical personnel.,4,6
Adjust dental devices or appliances to ensure fit.,4,6
Teach social science courses at the college level.,4,6
Assemble wood products.,4,6
Accompany patients or clients on outings to provide assistance.,5,5
Communicate safety or hazard information to others.,5,5
Research product safety.,5,5
Record information from legal proceedings.,5,5
Inspect cargo to identify potential hazards.,5,5
Process animal carcasses.,5,5
"Advise athletes, coaches, or trainers on exercise regimens, nutrition, or equipment use.",5,5
Prepare film for distribution or use.,5,5
Establish treatment goals.,5,5
Implement design or process improvements.,5,5
Issue permits or other legal documents.,5,5
Assist patrons with entering or exiting vehicles or other forms of transportation.,5,5
Conduct historical research.,5,5
Read to students.,5,5
Administer oaths to court participants.,5,5
Respond to transportation emergencies.,5,5
Rule on admissibility of legal proceedings.,5,5
"Inform the public about policies, services or procedures.",5,5
Advise others on educational matters.,6,4
Direct employee training programs.,6,4
Investigate accidents to determine causes.,6,4
Issue certificates or licenses.,6,4
Direct law enforcement activities.,6,4
Inspect medical or dental assistive devices.,6,4
Draw guide lines or markings on materials or workpieces using patterns or other references.,6,4
Apply makeup to alter or enhance appearance.,6,4
Install drilling equipment.,6,4
Monitor operations to ensure compliance with safety or security policies or regulations.,6,4
Inspect locomotives or other railroad equipment.,6,4
Encourage patients during therapeutic activities.,6,4
Encourage patients or clients to develop life skills.,6,4
Update knowledge of legal or regulatory environments.,6,4
Maintain social services program records.,6,4
"Estimate supplies, ingredients, or staff requirements for food preparation activities.",6,4
Examine personal documentation to ensure that it is valid.,6,4
Operate mining equipment.,6,4
"Fit eyeglasses, contact lenses, or other vision aids.",6,4
Measure distances or dimensions.,6,4
"Discuss performance, complaints, or violations with supervisors.",6,4
Teach humanities courses at the college level.,6,4
Develop fire safety or prevention programs or plans.,6,4
Create physical models or prototypes.,6,4
Coordinate project activities with other personnel or departments.,6,4
Cut meat products.,6,4
Assist motorists or pedestrians.,6,4
Write informational material.,6,4
Teach basic living or other adaptive skills to patients or caregivers.,6,4
Assign resources or facilities to patrons or employees.,6,4
Recommend personnel decisions or human resources activities.,6,4
Teach physical science or mathematics courses at the college level.,6,4
Supervise sales or support personnel.,6,4
Collaborate with law enforcement or security agencies to share information.,6,4
Shape glass or similar materials.,6,4
Promote agricultural or hunting activities.,6,4
Process customer bills or payments.,6,4
Solder parts or workpieces.,7,3
Authorize construction activities.,7,3
"Adjust equipment controls to regulate flow of water, cleaning solutions, or other liquids.",7,3
Apply multiple teaching methods.,7,3
Arbitrate disputes between parties to resolve legal conflicts.,7,3
Assess characteristics of fires.,7,3
Apply decorative coloring to photographs or printed materials.,7,3
Apply identification labels or tags.,7,3
Train medical providers.,7,3
Stay informed about current developments in field of specialization.,7,3
Analyze crime scene evidence.,7,3
Analyze financial records to improve budgeting or planning.,7,3
Assess product or process usefulness.,7,3
Train others on work processes.,7,3
Teach vocational courses.,7,3
Adjust tuning or functioning of musical instruments.,7,3
Build agricultural structures.,7,3
Develop detailed project plans.,7,3
Develop technical specifications for systems or equipment.,7,3
Patrol natural areas to ensure safety or enforce regulations.,7,3
"Drill holes in parts, equipment, or materials.",7,3
Read work orders to determine material or setup requirements.,7,3
Enter information into databases or software programs.,7,3
Design energy production or management equipment or systems.,7,3
Plan work operations.,7,3
"Plan conferences, programs, or special events.",7,3
Plan community programs or activities for the general public.,7,3
Record information about suspicious objects.,7,3
Develop database parameters or specifications.,7,3
Manage outreach activities.,7,3
Record operational or production data.,7,3
Record patient medical histories.,7,3
Maintain records of sales or other business transactions.,7,3
Fabricate devices or components.,7,3
Develop sustainable organizational policies or practices.,7,3
Operate laboratory or field equipment.,7,3
Develop computer or information systems.,7,3
Maintain vehicles in good working condition.,7,3
Cultivate land.,7,3
Develop instructional materials.,7,3
Develop scientific or mathematical models.,7,3
Develop promotional strategies for religious organizations.,7,3
Prepare land for agricultural use.,7,3
Shovel materials.,7,3
Develop organizational policies or programs.,7,3
Discuss problems or issues with supervisors.,7,3
Develop instructional objectives.,7,3
Prepare graphics or other visual representations of information.,7,3
Provide information about landscaping services or costs.,7,3
Prepare financial documents.,7,3
Manage organizational or program finances.,7,3
Prepare data for analysis.,7,3
Develop equipment or component configurations.,7,3
Drill holes in earth or rock.,7,3
Prepare business correspondence.,7,3
Provide for basic needs of children.,7,3
Gather customer or product information to determine customer needs.,7,3
Cut materials according to specifications or needs.,7,3
Maintain professional knowledge or certifications.,7,3
Inspect completed work to ensure proper functioning.,7,3
Collect evidence for legal proceedings.,7,3
Collaborate with technical specialists to resolve design or development problems.,7,3
Communicate patient status to other health practitioners.,7,3
Interpret cultural or religious information for others.,7,3
Sell agricultural products.,7,3
Collaborate with others to determine design specifications or details.,7,3
Maintain mechanical equipment.,7,3
Monitor recreational facility operations.,7,3
Host events.,7,3
Collaborate with law enforcement or security agencies to respond to incidents.,7,3
Monitor building premises to ensure occupant or visitor safety.,7,3
"Inspect facilities to ensure compliance with safety, quality, or service standards.",7,3
Collect geological samples.,7,3
"Negotiate contracts for transportation, distribution, or logistics services.",7,3
Research advanced engineering designs or applications.,7,3
Reshape metal workpieces to established specifications.,7,3
Maintain computer equipment or software.,7,3
Shape surfaces or edges of wood workpieces.,7,3
Remove products or workpieces from production equipment.,7,3
"Operate cranes, hoists, or other moving or lifting equipment.",7,3
Coordinate logistics for productions or events.,7,3
Identify implications for cases from legal precedents or other legal information.,7,3
Search individuals for illegal or dangerous items.,7,3
Confer with technical personnel to prepare designs or operational plans.,7,3
Confer with others to conduct or arrange operational activities.,7,3
Inform others about laws or regulations.,7,3
Negotiate purchases or contracts.,7,3
Supervise information technology personnel.,8,2
Repair electronic equipment.,8,2
Coordinate design activities.,8,2
Instruct workers to use equipment or perform technical procedures.,8,2
Monitor business indicators.,8,2
Repair electrical components.,8,2
Monitor loading processes to ensure they are performed properly.,8,2
Confiscate prohibited or dangerous items.,8,2
Coordinate construction or installation activities.,8,2
Assist practitioners to perform medical procedures.,8,2
"Interpret blueprints, specifications, or diagrams to inform installation, development or operation activities.",8,2
Correspond with customers to answer questions or resolve complaints.,8,2
Create graphical representations of civil structures.,8,2
Monitor equipment operation to ensure proper functioning.,8,2
Repair defective engines or engine components.,8,2
"Interview witnesses, suspects, or claimants.",8,2
Repair precision devices or workpieces.,8,2
Represent the organization in external relations.,8,2
Monitor computer system performance to ensure proper operation.,8,2
Monitor conditions at energy-producing landfills.,8,2
Supervise medical support personnel.,8,2
Coordinate operational activities.,8,2
Supervise production or support personnel.,8,2
Contact current or potential customers to promote products or services.,8,2
Investigate legal issues.,8,2
Create marketing materials.,8,2
Research diseases or parasites.,8,2
Conduct hearings to investigate legal issues.,8,2
Configure computer networks.,8,2
Maintain financial or account records.,8,2
"Select equipment, materials, or supplies for cleaning or maintenance activities.",8,2
Maintain material moving equipment in good working condition.,8,2
"Collect medical information from patients, family members, or other medical professionals.",8,2
Collect payments for good or services.,8,2
"Secure watercraft to docks, wharves or other vessels.",8,2
Collect samples of raw materials or finished products.,8,2
Watch operating equipment to detect malfunctions.,8,2
Maintain locomotives or other rail equipment in good working condition.,8,2
Measure environmental characteristics.,8,2
Communicate organizational information to customers or other stakeholders.,8,2
Sterilize medical equipment or instruments.,8,2
Communicate project information to others.,8,2
Maintain knowledge of current developments in area of expertise.,8,2
Schedule medical facility use.,8,2
Communicate with customers to resolve complaints or ensure satisfaction.,8,2
Collect geographical or geological field data.,8,2
Stack finished items for further processing or shipment.,8,2
"Collect deposits, payments or fees.",8,2
"Maintain records, documents, or other files.",8,2
Clean equipment or supplies.,8,2
Acquire supplies or equipment.,8,2
Classify materials according to standard systems.,8,2
Choose optimal transportation routes or speeds.,8,2
Clean production equipment.,8,2
Clean work areas or facilities.,8,2
Collaborate with healthcare professionals to plan or provide treatment.,8,2
Collect data about project sites.,8,2
"Service heating, ventilation or air-conditioning (HVAC) systems or components.",8,2
Collaborate with others to determine production details.,8,2
Serve court ordered documents.,8,2
Collaborate with others to resolve information technology issues.,8,2
Maintain personnel records.,8,2
Collect biological specimens.,8,2
Schedule dining reservations.,8,2
Maintain contingency plans for disaster recovery.,8,2
Research engineering applications of emerging technologies.,8,2
Review work orders or schedules to determine operations or procedures.,8,2
Liaise between departments or other groups to improve function or communication.,8,2
Administer therapeutic massages.,8,2
Level machines or equipment.,8,2
Confer with clients to discuss treatment plans or progress.,8,2
Confer with coworkers to coordinate maintenance or cleaning activities.,8,2
Lead classes or community events.,8,2
Research microbiological or chemical processes or structures.,8,2
Confer with customers or users to assess problems.,8,2
Supervise clerical or administrative personnel.,8,2
Confer with managers to make operational decisions.,8,2
Confer with other professionals to plan patient care.,8,2
Confer with others to resolve production problems or equipment malfunctions.,8,2
Research genetic characteristics or expression.,8,2
Verify application data to determine program eligibility.,8,2
Advise others on business or operational matters.,8,2
Load materials into production equipment.,8,2
Conduct research to gain information about products or processes.,8,2
Load or unload materials used in construction or extraction.,8,2
Stock supplies or merchandise.,8,2
Review technical documents to plan work.,8,2
Compile data or documentation.,8,2
Maintain client records.,8,2
Complete documentation required by programs or regulations.,8,2
Compute debt repayment schedules.,8,2
Review documents or materials for compliance with policies or regulations.,8,2
Meet with coworkers to communicate work orders or plans.,8,2
Conduct quantitative failure analyses of operational data.,8,2
Lubricate equipment to allow proper functioning.,8,2
Administer tests to assess educational needs or progress.,8,2
Locate natural resources using geospatial or other environmental data.,8,2
Locate fires or fire danger areas.,8,2
Monitor lubrication of equipment or workpieces.,8,2
Respond to customer inquiries.,8,2
"Remove accessories, tools, or other parts from equipment.",8,2
"Analyze operational data to evaluate operations, processes or products.",8,2
Cut fabrics.,8,2
Dismantle heavy equipment or machinery.,8,2
Operate farming equipment.,8,2
Test quality of materials or finished products.,8,2
Analyze environmental data.,8,2
Prepare instruction manuals.,8,2
Operate forestry equipment.,8,2
Analyze financial records or reports to determine state of operations.,8,2
Prepare hot or cold beverages.,8,2
Dispose of trash or waste materials.,8,2
Operate audiovisual equipment.,8,2
Operate garment treatment equipment.,8,2
Prepare foods or meals.,8,2
"Prepare financial documents, reports, or budgets.",8,2
Train caregivers or other non-medical personnel.,8,2
Treat dental problems or diseases.,8,2
"Format digital documents, data, or images.",8,2
Document network-related activities or tasks.,8,2
Operate excavation equipment.,8,2
"Discuss business strategies, practices, or policies with managers.",8,2
Disassemble equipment to inspect for deficiencies.,8,2
Prepare meat products for sale or consumption.,8,2
Implement advertising or marketing initiatives.,8,2
Diagnose medical conditions.,8,2
Dig holes or trenches.,8,2
Prepare proposal documents.,8,2
Cut industrial materials in preparation for fabrication or processing.,8,2
Direct energy production or management activities.,8,2
Trim client hair.,8,2
Treat patients using psychological therapies.,8,2
Identify environmental concerns.,8,2
Direct green energy production operations.,8,2
Analyze data to inform operational decisions or activities.,8,2
Direct maintenance and repair activities in green energy production facilities.,8,2
Operate diagnostic imaging equipment.,8,2
Analyze design or requirements information for mechanical equipment or systems.,8,2
Operate energy production equipment.,8,2
Document operational activities.,8,2
Document operational procedures.,8,2
Document technical design details.,8,2
Analyze logistics processes.,8,2
Estimate green project costs.,8,2
Estimate maintenance service requirements or costs.,8,2
Operate transportation equipment to demonstrate function or malfunction.,8,2
Plan environmental research.,8,2
Analyze test data or images to inform diagnosis or treatment.,8,2
Examine financial records or processes.,8,2
"Analyze security of systems, network, or data.",8,2
Evaluate data quality.,8,2
Train sales personnel.,8,2
Oversee business processes.,8,2
Perform clerical work in medical settings.,8,2
Package food or supplies.,8,2
Evaluate energy production data.,8,2
Evaluate environmental impact of operational or development activities.,8,2
Evaluate environmental or sustainability projects.,8,2
Estimate costs or terms of sales.,8,2
"Establish standards for products, processes, or procedures.",8,2
Document technical specifications or requirements.,8,2
Examine physical characteristics of gemstones or precious metals.,8,2
Document test results.,8,2
Treat chronic diseases or disorders.,8,2
Train customers in the use of products.,8,2
Edit written materials.,8,2
Train others in operational procedures.,8,2
Feed patients.,8,2
Practice athletic or artistic skills.,8,2
Pour materials into or on designated areas.,8,2
Enter codes or other information into computers.,8,2
Position patients for treatment or examination.,8,2
Analyze information obtained from news sources.,8,2
Explain technical medical information to patients.,8,2
Position construction forms or molds.,8,2
Plant greenery to improve landscape appearance.,8,2
Plan work procedures.,8,2
Analyze data to identify trends or relationships among variables.,8,2
Prepare project budgets.,8,2
Prepare surfaces for finishing.,8,2
"Inspect mechanical equipment to locate damage, defects, or wear.",8,2
Assign duties or work schedules to employees.,8,2
Recommend packing or shipping methods.,8,2
Design water conservation systems.,8,2
Design websites or web applications.,8,2
Inspect shipments to ensure correct order fulfillment.,8,2
Monitor the performance of computer networks.,8,2
Advise others on legal or regulatory compliance matters.,8,2
Determine protocols for medical procedures.,8,2
Mount materials or workpieces onto production equipment.,8,2
Determine resource needs.,8,2
Purchase products or services.,8,2
Advise others on ways to improve processes or products.,8,2
Assess locations for potential green technology installations.,8,2
Advise patients on effects of health conditions or treatments.,8,2
Inspect finishes of workpieces or finished products.,8,2
Provide safety training.,8,2
Recommend products or services to customers.,8,2
Inspect sustainable energy production facilities or equipment.,8,2
Monitor patient progress or responses to treatments.,8,2
"Monitor patient conditions during treatments, procedures, or activities.",8,2
Assist other educational professionals with projects or research.,8,2
Supervise workers performing environmentally sustainable activities.,8,2
Cut openings in existing structures.,8,2
Recruit personnel.,8,2
Record vital statistics or other health information.,8,2
Cut wood components for installation.,8,2
Deliver promotional presentations to current or prospective customers.,8,2
Record personnel information.,8,2
Assist healthcare practitioners during surgery.,8,2
Assist disabled or incapacitated individuals.,8,2
Record information from meetings or other formal proceedings.,8,2
Advise others on health and safety issues.,8,2
Install audio or communications equipment.,8,2
Teach daily living skills or behaviors.,8,2
Record information about environmental conditions.,8,2
Assess financial status of clients.,8,2
Develop collaborative relationships between departments or with external organizations.,8,2
Teach medical procedures to healthcare personnel.,8,2
Protect structures or surfaces near work areas to avoid damage.,8,2
Assemble garments or textile products.,8,2
Develop medical treatment plans.,8,2
Develop models of information or communications systems.,8,2
Negotiate sales or lease agreements for products or services.,8,2
Develop operational methods or processes that use green materials or emphasize sustainability.,8,2
"Notify others of emergencies, problems, or hazards.",8,2
Test electrical circuits or components for proper functioning.,8,2
Obtain copyrights or other legal permissions.,8,2
Develop procedures to evaluate organizational activities.,8,2
Develop professional relationships or networks.,8,2
Test green technologies or processes.,8,2
Test green technology installations to verify performance.,8,2
Develop software or computer applications.,8,2
Obtain written authorization to perform activities.,8,2
Test mechanical equipment to ensure proper functioning.,8,2
Arrange insurance coverage.,8,2
Develop testing routines or procedures.,8,2
Provide medical or cosmetic advice for clients.,8,2
"Promote products, services, or programs.",8,2
Apply new technologies to improve work processes.,8,2
Manage clerical or administrative activities.,8,2
Inspect equipment to locate or identify electrical problems.,8,2
Develop educational programs.,8,2
Provide customers with general information or assistance.,8,2
Advocate for individual or community needs.,8,2
Develop environmental research methods.,8,2
Develop emergency response plans or procedures.,8,2
"Move products, materials, or equipment between work areas.",8,2
Inspect facilities or sites to determine if they meet specifications or standards.,8,2
Monitor equipment operation to ensure that products are not flawed.,9,1
Monitor extraction operations.,9,1
Provide technical guidance to other personnel.,9,1
"Travel to work sites to perform installation, repair or maintenance work.",9,1
Monitor external affairs or events affecting business operations.,9,1
Treat animal injuries or illnesses.,9,1
Select resources needed to accomplish tasks.,9,1
Translate information for others.,9,1
Monitor food services operations to ensure procedures are followed.,9,1
Promote environmental sustainability or conservation initiatives.,9,1
"Train patients, family members, or caregivers in techniques for managing disabilities or illnesses.",9,1
Monitor organizational processes.,9,1
Monitor organizational procedures to ensure proper functioning.,9,1
Monitor organizational compliance with regulations.,9,1
Monitor operational quality or safety.,9,1
Protect patients or staff members using safety equipment.,9,1
Monitor nutrition related activities of individuals or groups.,9,1
Protect property from fire or water damage.,9,1
Provide attraction or event information to patrons.,9,1
"Replace worn, damaged, or defective mechanical parts.",9,1
Replace worn equipment components.,9,1
Train personnel on proper operational procedures.,9,1
Train personnel.,9,1
Treat facilities to eliminate pests.,9,1
Provide educational information to the public.,9,1
Provide first aid or rescue assistance in emergencies.,9,1
Monitor inventories of products or materials.,9,1
"Provide health and wellness advice to patients, program participants, or caregivers.",9,1
Provide information to coworkers.,9,1
Monitor instruments to ensure proper production conditions.,9,1
Monitor health or behavior of people or animals.,9,1
"Train workers in farming, forestry, or hunting techniques.",9,1
Provide customer service to clients or users.,9,1
Model operational processes.,9,1
Treat medical emergencies.,9,1
Verify that medical activities or operations meet standards.,9,1
Record information about legal matters.,9,1
Record images needed to address work issues.,9,1
Mark reference points on construction materials.,9,1
"Market products, services, or events.",9,1
Visit individuals in their homes to provide support or information.,9,1
Measure dimensions of completed products or workpieces to verify conformance to specifications.,9,1
Measure effectiveness of business strategies or practices.,9,1
Verify patron or staff credentials.,9,1
Provide technical support for software maintenance or use.,9,1
Remove trash.,9,1
Measure ingredients or substances to be used in production processes.,9,1
